{
    "$schema": "../$$schema.json",
    "added": "2023-7-1:05:12:00",
    "id": "primer",
    "title": "Primer",
    "description": "A theme that makes Discord look like GitHub's Primer design system.",
    "author": "TheCommieAxolotl",
    "repository": "TheCommieAxolotl/aero-addons",
    "sha256": "3bf77d70aaf4ccb6b8fac190fe457b8f027e2448",
    "path": "themes/Primer"
}
