{
    "$schema": "../$$schema.json",
    "added": "2023-7-1",
    "id": "prettyLinks",
    "title": "Pretty Links",
    "description": "Remove release channel information from message links.",
    "author": "TheCommieAxolotl",
    "repository": "TheCommieAxolotl/aero-addons",
    "sha256": "d651ab5ac412d6727dcf24cfa0bb1fa646490e13",
    "path": "plugins/prettylinks.ts"
}
