{
    "$schema": "../$$schema.json",
    "added": "2023-7-2:03:01:00",
    "id": "unmask",
    "title": "Unmask",
    "description": "Shows users with nicknames' usernames in chat.",
    "author": "TheCommieAxolotl",
    "repository": "TheCommieAxolotl/aero-addons",
    "sha256": "325b960e7b9219a7c0924c251bfe54988c42f4e2",
    "path": "plugins/unmask.tsx"
}
