[{"$schema":"../$$schema.json","added":"2023-7-1:07:49:00","id":"prettyLinks","title":"Pretty Links","description":"Remove release channel information from message links.","author":"TheCommieAxolotl","repository":"TheCommieAxolotl/aero-addons","sha256":"170d535d0253dbc1c6b8434e3bbd36b8431b2f67","path":"plugins/prettylinks.ts"},{"$schema":"../$$schema.json","added":"2023-7-1:07:49:00","id":"previewMessage","title":"Preview Message","description":"Allows you to preview a message before you send it.","author":"TheCommieAxolotl","repository":"TheCommieAxolotl/aero-addons","sha256":"170d535d0253dbc1c6b8434e3bbd36b8431b2f67","path":"plugins/PreviewMessage.tsx"},{"$schema":"../$$schema.json","added":"2023-7-2:03:01:00","id":"unmask","title":"Unmask","description":"Shows users with nicknames' usernames in chat.","author":"TheCommieAxolotl","repository":"TheCommieAxolotl/aero-addons","sha256":"325b960e7b9219a7c0924c251bfe54988c42f4e2","path":"plugins/unmask.tsx"}]